{
  "id": "HRC-001",
  "schema_version": "1.0",
  "draft_id": "d_f11d8de68709_mrwj1koh",
  "notes": "The canonical reference case. A fluent, specific, correctly hedged, brand-safe, lint-clean, genuinely novel draft whose central technical claim is false, on a thread that was already solved. Every automated gate passed it. This is the template every future case follows.",
  "thread": {
    "thread_id": "f11d8de68709",
    "subreddit": "Wordpress",
    "permalink": "https://www.reddit.com/r/Wordpress/comments/1v3evup/custom_css_missing_after_updraft_restore/",
    "title": "Custom CSS missing after Updraft restore",
    "body": "I messed something up so I restored an Updraft backup, but the whole site's colours, widths, radiuses etc are completely messed up\n\nI checked Site Settings Custom CSS and all the CSS I had is completely blank\n\nAdditional CSS is fine\n\nAny way I can get that Custom CSS back? I have the Updraft backup\n\nUPDATE:\n\nI downloaded the Updraft database file and extracted it. It was very big so I gave it to Claude and it found all the CSS.",
    "comment_count": 7,
    "resolved": true
  },
  "draft": {
    "body": "Custom CSS and Additional CSS often aren't stored the same way, which is why a restore can wipe one and leave the other intact. Additional CSS (Appearance > Customize) is its own dedicated entry. A theme/plugin's \"Site Settings > Custom CSS\" field is usually a single row in wp_options (or a single postmeta row) holding one large serialized value.\n\nBig single-row values like that are the ones most likely to get silently truncated during a SQL import if it hits a size limit (the DB server's max_allowed_packet, or a chunking limit in whatever tool did the restore) - the row inserts empty or truncated instead of throwing an error, while smaller settings restore fine.\n\nSince you already extracted the CSS from the backup dump, you can confirm this: check whether that option is present-but-empty in the live DB versus present-and-full in the backup dump. If so, that's a truncation issue, not a deliberate wipe, and it's worth checking your host's max_allowed_packet setting before your next restore so it doesn't happen again.",
    "created_at": "2026-07-22T20:20:36.977Z",
    "model": "claude-sonnet-5",
    "contribution": {
      "whyThread": "Nobody explained why the Custom CSS field emptied while Additional CSS survived, or how to stop it recurring on the next restore.",
      "whatNew": "Likely mechanism: Custom CSS is probably a single wp_options/postmeta row holding one large serialized value, which is exactly the kind of row that silently truncates during a SQL import if it hits max_allowed_packet or a chunking limit — Additional CSS survives because it's stored separately. Gives a concrete check (compare that option present-but-empty live vs full in the backup) and a prevention step (check max_allowed_packet before the next restore).",
      "whyNotSilent": "The extraction workaround fixes this instance but leaves the actual restore defect unaddressed, so the same field can go blank again next time."
    }
  },
  "human_review": {
    "verdict": "incorrect",
    "reviewer": "jerome",
    "reviewed_at": "2026-07-23",
    "notes": "Two independent grounds. (1) The central mechanism is false: MySQL raises ERROR 1153 (08S01) and aborts the import rather than silently inserting an empty or truncated row, and wp_options.option_value is LONGTEXT so column truncation cannot explain it either. (2) The thread was already resolved — the post body carries \"UPDATE: ... it found all the CSS\" and the original poster confirmed a fix beneath two comments. Full review at reports/HRC-001-custom-css-updraft.md."
  },
  "ground_truth": {
    "sources": [
      {
        "assertion": "Exceeding max_allowed_packet raises ERROR 1153 (08S01) and terminates the connection; it does not silently insert an empty or truncated row",
        "source": "MySQL 8.4 Reference Manual, \"Packet Too Large\": \"When a MySQL client or the mysqld server receives a packet bigger than max_allowed_packet bytes, it issues an ER_NET_PACKET_TOO_LARGE error and closes the connection.\" MySQL 8.0 Server Error Reference: error 1153, SQLSTATE 08S01, ER_NET_PACKET_TOO_LARGE, \"Got a packet bigger than 'max_allowed_packet' bytes\".",
        "source_type": "official-documentation",
        "url": "https://dev.mysql.com/doc/refman/8.4/en/packet-too-large.html",
        "verification": "RE-VERIFIED 2026-07-23 against the vendor manual, quoted verbatim above, replacing the earlier \"independent web sources, not re-read\" note the record itself flagged. Precision worth keeping: the error-reference page lists the code/SQLSTATE/message but does NOT describe abort semantics; the abort behaviour comes from the separate \"Packet Too Large\" page, which is the sentence quoted. Two pages, two facts."
      },
      {
        "assertion": "wp_options.option_value is LONGTEXT, so column-width truncation cannot explain a blanked Custom CSS value",
        "source": "WordPress core schema, wp-admin/includes/schema.php (trunk): \"CREATE TABLE $wpdb->options ( option_id bigint(20) unsigned NOT NULL auto_increment, option_name varchar(191) NOT NULL default '', option_value longtext NOT NULL, autoload varchar(20) NOT NULL default 'yes', ... )\"",
        "source_type": "source-code",
        "url": "https://raw.githubusercontent.com/WordPress/wordpress-develop/trunk/src/wp-admin/includes/schema.php",
        "verification": "RE-VERIFIED 2026-07-23 by reading the canonical schema in wordpress-develop trunk, quoted verbatim. Evidence class upgraded from vendor-documentation to source-code — this is the definition itself, not a description of it."
      },
      {
        "assertion": "The thread was already resolved by the asker before the draft was written",
        "source": "the thread itself, stored in data/threads.json",
        "source_type": "primary-observation",
        "url": null,
        "verification": "Deterministic string match over the post body and comment authors, reproducible offline with zero model calls. Recorded as E-22/E-23. Unchanged."
      }
    ],
    "claims_reviewed": 3,
    "claim_labels": [
      {
        "claim_id": "c5",
        "truth": "false",
        "expected_provenance": "reasoned-inference",
        "expected_epistemic": "explicitly-uncertain",
        "rests_on": [],
        "note": "Silent truncation of large single-row values on import is not the documented behaviour."
      },
      {
        "claim_id": "c6",
        "truth": "false",
        "expected_provenance": "reasoned-inference",
        "expected_epistemic": "explicitly-uncertain",
        "rests_on": [],
        "note": "max_allowed_packet produces an abort, not a truncation."
      },
      {
        "claim_id": "c7",
        "truth": "false",
        "expected_provenance": "reasoned-inference",
        "expected_epistemic": "explicitly-uncertain",
        "rests_on": [],
        "note": "THE central false claim. \"The row is inserted as empty or truncated without raising an error\" — MySQL raises ERROR 1153 and aborts."
      }
    ],
    "expected_claims": null
  },
  "expected": {
    "verdict": [
      "REJECT"
    ],
    "appropriate": "REJECT",
    "rules_required": [
      "thread-resolved",
      "fatal-contradiction"
    ],
    "rules_forbidden": [
      "all-claims-supported"
    ]
  },
  "argus_observed": {
    "certified_at": "2026-07-22T21:19:56.588Z",
    "model": "claude-haiku-4-5-20251001",
    "verdict": "REJECT",
    "claims": [
      {
        "id": "c1",
        "text": "Custom CSS and Additional CSS are stored using different methods in WordPress",
        "type": "observation",
        "evidenceClass": "framework-documentation",
        "evidenceDetail": "WordPress documentation and code show separate storage locations: Customizer Additional CSS versus theme/plugin custom CSS settings",
        "confidence": "high",
        "dependsOn": [],
        "sourceQuote": "Custom CSS and Additional CSS often aren't stored the same way"
      },
      {
        "id": "c2",
        "text": "Because they are stored in different locations, a restore can delete Custom CSS while preserving Additional CSS",
        "type": "inference",
        "evidenceClass": "reasoned-inference",
        "evidenceDetail": "If two settings exist in separate database locations, a restore targeting one location would not affect the other",
        "confidence": "medium",
        "dependsOn": [
          "c1"
        ],
        "sourceQuote": "which is why a restore can wipe one and leave the other intact"
      },
      {
        "id": "c3",
        "text": "Additional CSS from Appearance > Customize is stored as a dedicated single database entry",
        "type": "implementation-detail",
        "evidenceClass": "framework-documentation",
        "evidenceDetail": "WordPress Customizer stores Additional CSS as a distinct setting entry",
        "confidence": "high",
        "dependsOn": [],
        "sourceQuote": "Additional CSS (Appearance > Customize) is its own dedicated entry"
      },
      {
        "id": "c4",
        "text": "Custom CSS from theme/plugin settings is typically stored as a single row in wp_options or postmeta containing a large serialized value",
        "type": "implementation-detail",
        "evidenceClass": "framework-documentation",
        "evidenceDetail": "Standard WordPress and theme/plugin patterns store custom CSS as a single serialized option or post meta row",
        "confidence": "high",
        "dependsOn": [],
        "sourceQuote": "A theme/plugin's 'Site Settings > Custom CSS' field is usually a single row in wp_options (or a single postmeta row) holding one large serialized value"
      },
      {
        "id": "c5",
        "text": "Large single-row database values are most prone to silent truncation during SQL import when a size limit is exceeded",
        "type": "protocol-behaviour",